<?xml version="1.0" encoding="UTF-8" standalone="yes"?>
<RSIObjects xsi:noNamespaceSchemaLocation="/Roboter/Config/System/Common/Schemes/RSIContext.xsd" xmlns:xsi="http://www.w3.org/2001/XMLSchema-instance">
  <RSIObject ObjType="TRAFO_USERFRAME" ObjTypeID="65" ObjID="TRAFO_USERFRAME1">
    <Inputs>
      <Input InIdx="1" OutObjID="SOURCE1" OutIdx="1" />
      <Input InIdx="2" OutObjID="SOURCE2" OutIdx="1" />
      <Input InIdx="3" OutObjID="SOURCE3" OutIdx="1" />
    </Inputs>
    <Parameters>
      <Parameter Name="Type" ParamID="1" ParamValue="0" />
      <Parameter Name="FraX" ParamID="2" ParamValue="80.0" />
      <Parameter Name="FraY" ParamID="3" ParamValue="0.0" />
      <Parameter Name="FraZ" ParamID="4" ParamValue="-100.0" />
      <Parameter Name="FraA" ParamID="5" ParamValue="0.0" />
      <Parameter Name="FraB" ParamID="6" ParamValue="0.0" />
      <Parameter Name="FraC" ParamID="7" ParamValue="90" />
    </Parameters>
  </RSIObject>
  <RSIObject ObjType="SOURCE" ObjTypeID="45" ObjID="SOURCE1">
    <Parameters>
      <Parameter Name="Type" ParamID="1" ParamValue="0" />
      <Parameter Name="Offset" ParamID="2" ParamValue="300" />
      <Parameter Name="Amplitude" ParamID="3" ParamValue="1" />
      <Parameter Name="Period" ParamID="4" ParamValue="5" />
    </Parameters>
  </RSIObject>
  <RSIObject ObjType="SOURCE" ObjTypeID="45" ObjID="SOURCE2">
    <Parameters>
      <Parameter Name="Type" ParamID="1" ParamValue="0" />
      <Parameter Name="Offset" ParamID="2" ParamValue="0" />
      <Parameter Name="Amplitude" ParamID="3" ParamValue="1" />
      <Parameter Name="Period" ParamID="4" ParamValue="5" />
    </Parameters>
  </RSIObject>
  <RSIObject ObjType="SOURCE" ObjTypeID="45" ObjID="SOURCE3">
    <Parameters>
      <Parameter Name="Type" ParamID="1" ParamValue="0" />
      <Parameter Name="Offset" ParamID="2" ParamValue="-50" />
      <Parameter Name="Amplitude" ParamID="3" ParamValue="1" />
      <Parameter Name="Period" ParamID="4" ParamValue="5" />
    </Parameters>
  </RSIObject>
  <RSIObject ObjType="TRAFO_USERFRAME" ObjTypeID="65" ObjID="TRAFO_USERFRAME2">
    <Inputs>
      <Input InIdx="1" OutObjID="SOURCE4" OutIdx="1" />
      <Input InIdx="2" OutObjID="SOURCE5" OutIdx="1" />
      <Input InIdx="3" OutObjID="SOURCE6" OutIdx="1" />
    </Inputs>
    <Parameters>
      <Parameter Name="Type" ParamID="1" ParamValue="2" />
      <Parameter Name="FraX" ParamID="2" ParamValue="80.0" />
      <Parameter Name="FraY" ParamID="3" ParamValue="0.0" />
      <Parameter Name="FraZ" ParamID="4" ParamValue="-100.0" />
      <Parameter Name="FraA" ParamID="5" ParamValue="0" />
      <Parameter Name="FraB" ParamID="6" ParamValue="0" />
      <Parameter Name="FraC" ParamID="7" ParamValue="90" />
    </Parameters>
  </RSIObject>
  <RSIObject ObjType="SOURCE" ObjTypeID="45" ObjID="SOURCE4">
    <Parameters>
      <Parameter Name="Type" ParamID="1" ParamValue="0" />
      <Parameter Name="Offset" ParamID="2" ParamValue="90" />
      <Parameter Name="Amplitude" ParamID="3" ParamValue="1" />
      <Parameter Name="Period" ParamID="4" ParamValue="5" />
    </Parameters>
  </RSIObject>
  <RSIObject ObjType="SOURCE" ObjTypeID="45" ObjID="SOURCE5">
    <Parameters>
      <Parameter Name="Type" ParamID="1" ParamValue="0" />
      <Parameter Name="Offset" ParamID="2" ParamValue="0" />
      <Parameter Name="Amplitude" ParamID="3" ParamValue="1" />
      <Parameter Name="Period" ParamID="4" ParamValue="5" />
    </Parameters>
  </RSIObject>
  <RSIObject ObjType="SOURCE" ObjTypeID="45" ObjID="SOURCE6">
    <Parameters>
      <Parameter Name="Type" ParamID="1" ParamValue="0" />
      <Parameter Name="Offset" ParamID="2" ParamValue="90" />
      <Parameter Name="Amplitude" ParamID="3" ParamValue="1" />
      <Parameter Name="Period" ParamID="4" ParamValue="5" />
    </Parameters>
  </RSIObject>
  <RSIObject ObjType="TRAFO_ROBFRAME" ObjTypeID="66" ObjID="TRAFO_ROBFRAME1">
    <Inputs>
      <Input InIdx="1" OutObjID="TRAFO_USERFRAME1" OutIdx="1" />
      <Input InIdx="2" OutObjID="TRAFO_USERFRAME1" OutIdx="2" />
      <Input InIdx="3" OutObjID="TRAFO_USERFRAME1" OutIdx="3" />
    </Inputs>
    <Parameters>
      <Parameter Name="Type" ParamID="1" ParamValue="0" />
      <Parameter Name="Source" ParamID="2" ParamValue="3" />
      <Parameter Name="Target" ParamID="3" ParamValue="1" />
    </Parameters>
  </RSIObject>
  <RSIObject ObjType="TRAFO_ROBFRAME" ObjTypeID="66" ObjID="TRAFO_ROBFRAME2">
    <Inputs>
      <Input InIdx="1" OutObjID="TRAFO_USERFRAME2" OutIdx="1" />
      <Input InIdx="2" OutObjID="TRAFO_USERFRAME2" OutIdx="2" />
      <Input InIdx="3" OutObjID="TRAFO_USERFRAME2" OutIdx="3" />
    </Inputs>
    <Parameters>
      <Parameter Name="Type" ParamID="1" ParamValue="2" />
      <Parameter Name="Source" ParamID="2" ParamValue="3" />
      <Parameter Name="Target" ParamID="3" ParamValue="1" />
    </Parameters>
  </RSIObject>
  <RSIObject ObjType="MONITOR" ObjTypeID="55" ObjID="MONITOR1">
    <Inputs>
      <Input InIdx="1" OutObjID="TRAFO_ROBFRAME1" OutIdx="1" />
      <Input InIdx="2" OutObjID="TRAFO_ROBFRAME1" OutIdx="2" />
      <Input InIdx="3" OutObjID="TRAFO_ROBFRAME1" OutIdx="3" />
      <Input InIdx="4" OutObjID="TRAFO_ROBFRAME2" OutIdx="1" />
      <Input InIdx="5" OutObjID="TRAFO_ROBFRAME2" OutIdx="2" />
      <Input InIdx="6" OutObjID="TRAFO_ROBFRAME2" OutIdx="3" />
    </Inputs>
    <Parameters>
      <Parameter Name="Refresh" ParamID="1" ParamValue="1" />
      <Parameter Name="IP" ParamID="1" ParamValue="192.168.0.1" IsRuntime="false" />
      <Parameter Name="Channel" ParamID="2" ParamValue="1" IsRuntime="false" />
    </Parameters>
  </RSIObject>
</RSIObjects>