<?xml version="1.0" encoding="UTF-8" standalone="yes"?>
<RSIObjects xsi:noNamespaceSchemaLocation="/Roboter/Config/System/Common/Schemes/RSIContext.xsd" xmlns:xsi="http://www.w3.org/2001/XMLSchema-instance">
  <RSIObject ObjType="ETHERNET" ObjTypeID="64" ObjID="ETHERNET1">
    <Inputs>
      <Input InIdx="1" OutObjID="DIGOUT1" OutIdx="1" />
      <Input InIdx="2" OutObjID="DIGOUT2" OutIdx="1" />
    </Inputs>
    <Parameters>
      <Parameter Name="ConfigFile" ParamID="1" ParamValue="test5.xml" IsRuntime="false" />
      <Parameter Name="Timeout" ParamID="1" ParamValue="100" />
      <Parameter Name="Flag" ParamID="4" ParamValue="1" />
      <Parameter Name="Precision" ParamID="8" ParamValue="9" />
    </Parameters>
  </RSIObject>
  <RSIObject ObjType="AXISCORR" ObjTypeID="33" ObjID="AXISCORR1">
    <Inputs>
      <Input InIdx="1" OutObjID="ETHERNET1" OutIdx="12" />
      <Input InIdx="2" OutObjID="ETHERNET1" OutIdx="13" />
      <Input InIdx="3" OutObjID="ETHERNET1" OutIdx="14" />
      <Input InIdx="4" OutObjID="ETHERNET1" OutIdx="15" />
      <Input InIdx="5" OutObjID="ETHERNET1" OutIdx="16" />
      <Input InIdx="6" OutObjID="ETHERNET1" OutIdx="17" />
    </Inputs>
    <Parameters>
      <Parameter Name="LowerLimA1" ParamID="1" ParamValue="-1000" />
      <Parameter Name="LowerLimA2" ParamID="2" ParamValue="-1000" />
      <Parameter Name="LowerLimA3" ParamID="3" ParamValue="-1000" />
      <Parameter Name="LowerLimA4" ParamID="4" ParamValue="-1000" />
      <Parameter Name="LowerLimA5" ParamID="5" ParamValue="-1000" />
      <Parameter Name="LowerLimA6" ParamID="6" ParamValue="-1000" />
      <Parameter Name="UpperLimA1" ParamID="13" ParamValue="1000" />
      <Parameter Name="UpperLimA2" ParamID="14" ParamValue="1000" />
      <Parameter Name="UpperLimA3" ParamID="15" ParamValue="1000" />
      <Parameter Name="UpperLimA4" ParamID="16" ParamValue="1000" />
      <Parameter Name="UpperLimA5" ParamID="17" ParamValue="1000" />
      <Parameter Name="UpperLimA6" ParamID="18" ParamValue="1000" />
    </Parameters>
  </RSIObject>
  <RSIObject ObjType="STOP" ObjTypeID="18" ObjID="STOP1">
    <Inputs>
      <Input InIdx="1" OutObjID="ETHERNET1" OutIdx="5" />
    </Inputs>
    <Parameters>
      <Parameter Name="Mode" ParamID="1" ParamValue="4" />
      <Parameter Name="Channel" ParamID="2" ParamValue="0" />
    </Parameters>
  </RSIObject>
  <RSIObject ObjType="MAP2SEN_PINT" ObjTypeID="16" ObjID="MAP2SEN_PINT1">
    <Inputs>
      <Input InIdx="1" OutObjID="ETHERNET1" OutIdx="1" />
    </Inputs>
    <Parameters>
      <Parameter Name="Index" ParamID="1" ParamValue="1" />
    </Parameters>
  </RSIObject>
  <RSIObject ObjType="MAP2SEN_PINT" ObjTypeID="16" ObjID="MAP2SEN_PINT2">
    <Inputs>
      <Input InIdx="1" OutObjID="ETHERNET1" OutIdx="2" />
    </Inputs>
    <Parameters>
      <Parameter Name="Index" ParamID="1" ParamValue="2" />
    </Parameters>
  </RSIObject>
  <RSIObject ObjType="MAP2SEN_PINT" ObjTypeID="16" ObjID="MAP2SEN_PINT3">
    <Inputs>
      <Input InIdx="1" OutObjID="ETHERNET1" OutIdx="3" />
    </Inputs>
    <Parameters>
      <Parameter Name="Index" ParamID="1" ParamValue="3" />
    </Parameters>
  </RSIObject>
  <RSIObject ObjType="MAP2SEN_PINT" ObjTypeID="16" ObjID="MAP2SEN_PINT4">
    <Inputs>
      <Input InIdx="1" OutObjID="ETHERNET1" OutIdx="4" />
    </Inputs>
    <Parameters>
      <Parameter Name="Index" ParamID="1" ParamValue="4" />
    </Parameters>
  </RSIObject>
  <RSIObject ObjType="MAP2SEN_PREA" ObjTypeID="17" ObjID="MAP2SEN_PREA1">
    <Inputs>
      <Input InIdx="1" OutObjID="ETHERNET1" OutIdx="6" />
    </Inputs>
    <Parameters>
      <Parameter Name="Index" ParamID="1" ParamValue="1" />
    </Parameters>
  </RSIObject>
  <RSIObject ObjType="MAP2SEN_PREA" ObjTypeID="17" ObjID="MAP2SEN_PREA2">
    <Inputs>
      <Input InIdx="1" OutObjID="ETHERNET1" OutIdx="7" />
    </Inputs>
    <Parameters>
      <Parameter Name="Index" ParamID="1" ParamValue="2" />
    </Parameters>
  </RSIObject>
  <RSIObject ObjType="MAP2SEN_PREA" ObjTypeID="17" ObjID="MAP2SEN_PREA3">
    <Inputs>
      <Input InIdx="1" OutObjID="ETHERNET1" OutIdx="8" />
    </Inputs>
    <Parameters>
      <Parameter Name="Index" ParamID="1" ParamValue="3" />
    </Parameters>
  </RSIObject>
  <RSIObject ObjType="MAP2SEN_PREA" ObjTypeID="17" ObjID="MAP2SEN_PREA4">
    <Inputs>
      <Input InIdx="1" OutObjID="ETHERNET1" OutIdx="9" />
    </Inputs>
    <Parameters>
      <Parameter Name="Index" ParamID="1" ParamValue="4" />
    </Parameters>
  </RSIObject>
  <RSIObject ObjType="MAP2SEN_PREA" ObjTypeID="17" ObjID="MAP2SEN_PREA5">
    <Inputs>
      <Input InIdx="1" OutObjID="ETHERNET1" OutIdx="10" />
    </Inputs>
    <Parameters>
      <Parameter Name="Index" ParamID="1" ParamValue="5" />
    </Parameters>
  </RSIObject>
  <RSIObject ObjType="MAP2SEN_PREA" ObjTypeID="17" ObjID="MAP2SEN_PREA6">
    <Inputs>
      <Input InIdx="1" OutObjID="ETHERNET1" OutIdx="11" />
    </Inputs>
    <Parameters>
      <Parameter Name="Index" ParamID="1" ParamValue="6" />
    </Parameters>
  </RSIObject>
  <RSIObject ObjType="DIGOUT" ObjTypeID="43" ObjID="DIGOUT1">
    <Parameters>
      <Parameter Name="Index" ParamID="1" ParamValue="500" />
      <Parameter Name="DataSize" ParamID="2" ParamValue="0" />
    </Parameters>
  </RSIObject>
  <RSIObject ObjType="DIGOUT" ObjTypeID="43" ObjID="DIGOUT2">
    <Parameters>
      <Parameter Name="Index" ParamID="1" ParamValue="400" />
      <Parameter Name="DataSize" ParamID="2" ParamValue="0" />
    </Parameters>
  </RSIObject>
  <RSIObject ObjType="AXISCORRMON" ObjTypeID="82" ObjID="AXISCORRMON1">
    <Parameters>
      <Parameter Name="MaxA1" ParamID="1" ParamValue="1000" />
      <Parameter Name="MaxA2" ParamID="2" ParamValue="1000" />
      <Parameter Name="MaxA3" ParamID="3" ParamValue="1000" />
      <Parameter Name="MaxA4" ParamID="4" ParamValue="1000" />
      <Parameter Name="MaxA5" ParamID="5" ParamValue="1000" />
      <Parameter Name="MaxA6" ParamID="6" ParamValue="1000" />
      <Parameter Name="MaxE1" ParamID="7" ParamValue="6.0" />
      <Parameter Name="MaxE2" ParamID="8" ParamValue="6.0" />
      <Parameter Name="MaxE3" ParamID="9" ParamValue="6.0" />
      <Parameter Name="MaxE4" ParamID="10" ParamValue="6.0" />
      <Parameter Name="MaxE5" ParamID="11" ParamValue="6.0" />
      <Parameter Name="MaxE6" ParamID="12" ParamValue="6.0" />
    </Parameters>
  </RSIObject>
</RSIObjects>