<?xml version="1.0" encoding="UTF-8" standalone="yes"?>
<RSIObjects xsi:noNamespaceSchemaLocation="/Roboter/Config/System/Common/Schemes/RSIContext.xsd" xmlns:xsi="http://www.w3.org/2001/XMLSchema-instance">
  <RSIObject ObjType="ANIN" ObjTypeID="30" ObjID="ANIN1">
    <Parameters>
      <Parameter Name="Index" ParamID="1" ParamValue="1" />
    </Parameters>
  </RSIObject>
  <RSIObject ObjType="P" ObjTypeID="28" ObjID="P1">
    <Inputs>
      <Input InIdx="1" OutObjID="ANIN1" OutIdx="1" />
    </Inputs>
    <Parameters>
      <Parameter Name="KR" ParamID="1" ParamValue="35" />
    </Parameters>
  </RSIObject>
  <RSIObject ObjType="SUM" ObjTypeID="31" ObjID="SUM1">
    <Inputs>
      <Input InIdx="1" OutObjID="P1" OutIdx="1" />
    </Inputs>
    <Parameters>
      <Parameter Name="cVal" ParamID="1" ParamValue="65" />
    </Parameters>
  </RSIObject>
  <RSIObject ObjType="SUM" ObjTypeID="31" ObjID="SUM2">
    <Inputs>
      <Input InIdx="1" OutObjID="SUM1" OutIdx="1" />
    </Inputs>
    <Parameters>
      <Parameter Name="cVal" ParamID="1" ParamValue="-50" />
    </Parameters>
  </RSIObject>
  <RSIObject ObjType="POSCORR" ObjTypeID="27" ObjID="POSCORR1">
    <Inputs>
      <Input InIdx="3" OutObjID="P2" OutIdx="1" />
    </Inputs>
    <Parameters>
      <Parameter Name="LowerLimX" ParamID="1" ParamValue="-5" />
      <Parameter Name="LowerLimY" ParamID="2" ParamValue="-5" />
      <Parameter Name="LowerLimZ" ParamID="3" ParamValue="-20" />
      <Parameter Name="UpperLimX" ParamID="4" ParamValue="5" />
      <Parameter Name="UpperLimY" ParamID="5" ParamValue="5" />
      <Parameter Name="UpperLimZ" ParamID="6" ParamValue="20" />
      <Parameter Name="MaxRotAngle" ParamID="7" ParamValue="5" />
      <Parameter Name="RefCorrSys" ParamID="1" ParamValue="1" IsRuntime="false" />
    </Parameters>
  </RSIObject>
  <RSIObject ObjType="P" ObjTypeID="28" ObjID="P2">
    <Inputs>
      <Input InIdx="1" OutObjID="SUM2" OutIdx="1" />
    </Inputs>
    <Parameters>
      <Parameter Name="KR" ParamID="1" ParamValue="0.001" />
    </Parameters>
  </RSIObject>
  <RSIObject ObjType="EQUAL" ObjTypeID="7" ObjID="EQUAL1">
    <Inputs>
      <Input InIdx="1" OutObjID="ANIN1" OutIdx="1" />
    </Inputs>
    <Parameters>
      <Parameter Name="CompVal" ParamID="1" ParamValue="0.0" />
      <Parameter Name="Tolerance" ParamID="2" ParamValue="0.9" />
    </Parameters>
  </RSIObject>
  <RSIObject ObjType="NOT" ObjTypeID="10" ObjID="NOT1">
    <Inputs>
      <Input InIdx="1" OutObjID="EQUAL1" OutIdx="1" />
    </Inputs>
  </RSIObject>
  <RSIObject ObjType="STOP" ObjTypeID="18" ObjID="STOP1">
    <Inputs>
      <Input InIdx="1" OutObjID="NOT1" OutIdx="1" />
    </Inputs>
    <Parameters>
      <Parameter Name="Mode" ParamID="1" ParamValue="1" />
    </Parameters>
  </RSIObject>
  <RSIObject ObjType="GREATER" ObjTypeID="6" ObjID="GREATER1">
    <Inputs>
      <Input InIdx="1" OutObjID="POSCORR1" OutIdx="1" />
    </Inputs>
    <Parameters>
      <Parameter Name="CompVal" ParamID="1" ParamValue="1.0" />
      <Parameter Name="Hysteresis" ParamID="2" ParamValue="0.0" />
    </Parameters>
  </RSIObject>
  <RSIObject ObjType="STOP" ObjTypeID="18" ObjID="STOP2">
    <Inputs>
      <Input InIdx="1" OutObjID="GREATER1" OutIdx="1" />
    </Inputs>
    <Parameters>
      <Parameter Name="Mode" ParamID="1" ParamValue="1" />
    </Parameters>
  </RSIObject>
  <RSIObject ObjType="MONITOR" ObjTypeID="55" ObjID="MONITOR1">
    <Inputs>
      <Input InIdx="1" OutObjID="NOT1" OutIdx="1" />
      <Input InIdx="2" OutObjID="SUM1" OutIdx="1" />
      <Input InIdx="3" OutObjID="POSCORR1" OutIdx="4" />
      <Input InIdx="4" OutObjID="GREATER1" OutIdx="1" />
      <Input InIdx="5" OutObjID="POSACT1" OutIdx="2" />
      <Input InIdx="6" OutObjID="POSACT1" OutIdx="3" />
    </Inputs>
    <Parameters>
      <Parameter Name="Refresh" ParamID="1" ParamValue="1" />
      <Parameter Name="IP" ParamID="1" ParamValue="192.168.0.1" IsRuntime="false" />
      <Parameter Name="Channel" ParamID="2" ParamValue="1" IsRuntime="false" />
    </Parameters>
  </RSIObject>
  <RSIObject ObjType="POSCORRMON" ObjTypeID="81" ObjID="POSCORRMON1">
    <Parameters>
      <Parameter Name="MaxTrans" ParamID="1" ParamValue="25.0" />
      <Parameter Name="MaxRotAngle" ParamID="2" ParamValue="6.0" />
    </Parameters>
  </RSIObject>
  <RSIObject ObjType="POSACT" ObjTypeID="24" ObjID="POSACT1">
    <Parameters>
      <Parameter Name="Type" ParamID="1" ParamValue="0" />
    </Parameters>
  </RSIObject>
</RSIObjects>