<?xml version="1.0" encoding="UTF-8" standalone="yes"?>
<RSIObjects xsi:noNamespaceSchemaLocation="/Roboter/Config/System/Common/Schemes/RSIContext.xsd" xmlns:xsi="http://www.w3.org/2001/XMLSchema-instance">
  <RSIObject ObjType="DIGIN" ObjTypeID="29" ObjID="DIGIN1">
    <Parameters>
      <Parameter Name="Index" ParamID="1" ParamValue="1" />
      <Parameter Name="DataSize" ParamID="2" ParamValue="2" />
    </Parameters>
  </RSIObject>
  <RSIObject ObjType="DIGOUT" ObjTypeID="43" ObjID="DIGOUT1">
    <Parameters>
      <Parameter Name="Index" ParamID="1" ParamValue="1" />
      <Parameter Name="DataSize" ParamID="2" ParamValue="0" />
    </Parameters>
  </RSIObject>
  <RSIObject ObjType="DIGOUT" ObjTypeID="43" ObjID="DIGOUT2">
    <Parameters>
      <Parameter Name="Index" ParamID="1" ParamValue="2" />
      <Parameter Name="DataSize" ParamID="2" ParamValue="0" />
    </Parameters>
  </RSIObject>
  <RSIObject ObjType="DIGOUT" ObjTypeID="43" ObjID="DIGOUT3">
    <Parameters>
      <Parameter Name="Index" ParamID="1" ParamValue="3" />
      <Parameter Name="DataSize" ParamID="2" ParamValue="0" />
    </Parameters>
  </RSIObject>
  <RSIObject ObjType="SOURCE" ObjTypeID="45" ObjID="SOURCE1">
    <Parameters>
      <Parameter Name="Type" ParamID="1" ParamValue="1" />
      <Parameter Name="Offset" ParamID="2" ParamValue="0" />
      <Parameter Name="Amplitude" ParamID="3" ParamValue="50" />
      <Parameter Name="Period" ParamID="4" ParamValue="5" />
    </Parameters>
  </RSIObject>
  <RSIObject ObjType="POSCORR" ObjTypeID="27" ObjID="POSCORR1">
    <Inputs>
      <Input InIdx="1" OutObjID="ETHERNET1" OutIdx="1" />
      <Input InIdx="2" OutObjID="ETHERNET1" OutIdx="2" />
      <Input InIdx="3" OutObjID="ETHERNET1" OutIdx="3" />
      <Input InIdx="4" OutObjID="ETHERNET1" OutIdx="4" />
      <Input InIdx="5" OutObjID="ETHERNET1" OutIdx="5" />
      <Input InIdx="6" OutObjID="ETHERNET1" OutIdx="6" />
    </Inputs>
    <Parameters>
      <Parameter Name="LowerLimX" ParamID="1" ParamValue="-5" />
      <Parameter Name="LowerLimY" ParamID="2" ParamValue="-5" />
      <Parameter Name="LowerLimZ" ParamID="3" ParamValue="-5" />
      <Parameter Name="UpperLimX" ParamID="4" ParamValue="5" />
      <Parameter Name="UpperLimY" ParamID="5" ParamValue="5" />
      <Parameter Name="UpperLimZ" ParamID="6" ParamValue="5" />
      <Parameter Name="MaxRotAngle" ParamID="7" ParamValue="5" />
      <Parameter Name="RefCorrSys" ParamID="1" ParamValue="1" IsRuntime="false" />
    </Parameters>
  </RSIObject>
  <RSIObject ObjType="MAP2DIGOUT" ObjTypeID="14" ObjID="MAP2DIGOUT1">
    <Inputs>
      <Input InIdx="1" OutObjID="ETHERNET1" OutIdx="8" />
    </Inputs>
    <Parameters>
      <Parameter Name="Index" ParamID="1" ParamValue="2" />
      <Parameter Name="DataSize" ParamID="2" ParamValue="2" />
    </Parameters>
  </RSIObject>
  <RSIObject ObjType="MAP2SEN_PREA" ObjTypeID="17" ObjID="MAP2SEN_PREA1">
    <Inputs>
      <Input InIdx="1" OutObjID="ETHERNET1" OutIdx="1" />
    </Inputs>
    <Parameters>
      <Parameter Name="Index" ParamID="1" ParamValue="1" />
    </Parameters>
  </RSIObject>
  <RSIObject ObjType="MAP2SEN_PREA" ObjTypeID="17" ObjID="MAP2SEN_PREA2">
    <Inputs>
      <Input InIdx="1" OutObjID="ETHERNET1" OutIdx="2" />
    </Inputs>
    <Parameters>
      <Parameter Name="Index" ParamID="1" ParamValue="2" />
    </Parameters>
  </RSIObject>
  <RSIObject ObjType="MAP2SEN_PREA" ObjTypeID="17" ObjID="MAP2SEN_PREA3">
    <Inputs>
      <Input InIdx="1" OutObjID="ETHERNET1" OutIdx="3" />
    </Inputs>
    <Parameters>
      <Parameter Name="Index" ParamID="1" ParamValue="3" />
    </Parameters>
  </RSIObject>
  <RSIObject ObjType="ETHERNET" ObjTypeID="64" ObjID="ETHERNET1">
    <Inputs>
      <Input InIdx="1" OutObjID="DIGIN1" OutIdx="1" />
      <Input InIdx="2" OutObjID="DIGOUT1" OutIdx="1" />
      <Input InIdx="3" OutObjID="DIGOUT2" OutIdx="1" />
      <Input InIdx="4" OutObjID="DIGOUT3" OutIdx="1" />
      <Input InIdx="5" OutObjID="SOURCE1" OutIdx="1" />
    </Inputs>
    <Parameters>
      <Parameter Name="ConfigFile" ParamID="1" ParamValue="RSI_EthernetConfig.xml" IsRuntime="false" />
      <Parameter Name="Timeout" ParamID="1" ParamValue="100" />
      <Parameter Name="Flag" ParamID="4" ParamValue="1" />
      <Parameter Name="Precision" ParamID="8" ParamValue="1" />
    </Parameters>
  </RSIObject>
</RSIObjects>